"1470","When will Mariano Rajoy **vacate the office of Prime Minister of Spain?","Prime Minister Rajoy faces rising anger in Spain over corruption in the political system (http://www.independent.co.uk/news/world/europe/embattled-spanish-pm-mariano-rajoy-attempts-to-soothe-irate-public-over-corruption-9826790.html, http://www.ft.com/intl/cms/s/0/e2362e6a-64e5-11e4-ab2d-00144feabdc0.html). Outcome will be determined by credible open source media reporting (e.g., Reuters, BBC, AP) or **official announcements.","false",5,date,"2014-11-19","2015-12-31","",active,"2014-11-19 13:00:00","2015-06-15 06:00:00",,
"1471","When will Russia next launch an intercontinental ballistic missile (ICBM)?","Russia has recently been exercising all three components of its nuclear triad (http://www.janes.com/article/45524/russia-exercises-its-strategic-nuclear-triad, http://www.naval-technology.com/news/newsrussia-confirms-plans-to-conduct-bulava-missile-test-4436141). A launch of either a land-based or submarine-launched ICBM, for testing or military purposes, would count. Outcome will be determined by credible open source media reporting (e.g., Reuters, BBC, AP).","false",5,date,"2014-11-19","2015-06-11","",closed,"2014-11-19 13:00:00","2015-06-15 06:00:00","2014-11-19 13:00:00","2014-11-28 06:00:00"
"1472","When will negotiations on the Transatlantic Trade and Investment Partnership (TTIP) be completed?","Negotiations over the TTIP have stalled as a result of disagreement, among other issues, on the inclusion of an Investor-State Dispute Settlement (ISDS) provision (http://www.reuters.com/article/2014/10/30/us-usa-trade-ttip-idUSKBN0IJ2FC20141030, http://www.economist.com/news/finance-and-economics/21623756-governments-are-souring-treaties-protect-foreign-investors-arbitration, http://www.ustr.gov/about-us/press-office/blog/2014/March/Facts-Investor-State%20Dispute-Settlement-Safeguarding-Public-Interest-Protecting-Investors). Outcome will be determined by credible open source media reporting (e.g., Reuters, BBC, AP) or **official announcements.","false",5,date,"2014-11-19","2015-12-31","",active,"2014-11-19 13:00:00","2015-06-15 06:00:00",,
"1473","When will a free trade agreement between India and Israel be **officially reached?","India and Israel have been negotiating the terms of a free trade agreement for over three years (http://www.reuters.com/article/2014/11/23/us-india-israel-ties-idUSKCN0J70L520141123, http://www.thehindubusinessline.com/economy/indoisrael-fta-likely-by-yearend/article6192982.ece). Outcome will be determined by credible open source media reporting (e.g., Reuters, BBC, AP) or **official announcements. ","true",5,date,"2014-12-03","2015-12-31","",active,"2014-12-03 11:00:00","2015-06-15 06:00:00",,
"1474","When will Benjamin Netanyahu **vacate the office of Prime Minister of Israel?","Israeli Prime Minister Benjamin Netanyahu has come under pressure for making unpopular political decisions (http://www.nytimes.com/2014/12/03/world/middleeast/israel-netanyahu-cabinet-elections.html). Outcome will be determined by credible open source media reporting (e.g., Reuters, BBC, AP) or **official announcements.","true",5,date,"2014-12-03","2015-06-11","",active,"2014-12-03 11:00:00","2015-06-15 06:00:00",,
"1476","When will Standard & Poor's downgrade Russia's foreign currency credit rating to BB+ or below?","In April 2014, major credit rating agencies downgraded Russia's foreign currency credit rating, leaving the country's bonds at BBB-, the lowest investment grade according to Standard & Poor's (http://www.bloomberg.com/news/2014-10-24/russia-credit-rating-kept-above-junk-by-s-p-on-reserves.html, http://www.standardandpoors.com/ratings/definitions-and-faqs/en/us). Outcome will be determined by Standard and Poor's (e.g., http://www.standardandpoors.com/en_US/web/guest/ratings/press-releases) or credible open source media reporting of S&P data (e.g., Reuters, BBC, AP). If the resolution criteria are not met, GJP will assume the following as the ""status quo"" outcome: Standard & Poor's has not downgraded Russia's foreign currency credit rating to BB+ or below.","true",5,date,"2014-12-03","2015-12-31","",closed,"2014-12-03 11:00:00","2015-06-15 06:00:00","2014-12-03 11:00:00","2015-01-26 06:00:00"
"1477","When will the IMF **officially announce that the Chinese renminbi will be added to its Special Drawing Rights (SDR)?","The IMF's Special Drawing Rights, an international reserve asset currently valued based on a basket of four key international currencies, will be up for review in 2015 (http://www.imf.org/external/np/exr/facts/sdr.HTM, http://www.reuters.com/article/2014/10/29/china-summit-reserves-reuters-summit-idUSL4N0SO3VK20141029). The inclusion of the renminbi does not need to take effect for a ""yes"" resolution. Outcome will be determined by credible open source media reports (e.g., Reuters, BBC, AP) or **official announcements. If the resolution criteria are not met, GJP will assume the following as the ""status quo"" outcome: the IMF has not **officially announced that the Chinese renminbi will be added to its Special Drawing Rights.","true",5,date,"2014-12-03","2015-12-31","",active,"2014-12-03 11:00:00","2015-06-15 06:00:00",,
"1478","When will China next allow any members of the UK Parliament's Foreign Affairs Committee to enter Hong Kong?","China has banned members of the British Foreign Affairs Committee from entering Hong Kong (http://www.bbc.com/news/uk-politics-30275320, http://www.scmp.com/news/hong-kong/article/1657348/british-mps-barred-hong-kong-stop-oil-being-poured-over-fire-says). The question will resolve as ""yes"" based either on news that China will allow such a visit, or news of committee members actually entering Hong Kong. Outcome will be determined by credible open source media reporting (e.g., Reuters, BBC, AP) or **official announcements.","true",5,date,"2014-12-10","2015-06-11","",active,"2014-12-10 13:00:00","2015-06-15 06:00:00",,
"1479","When will there be a new *confirmed case of Ebola in Nigeria?","The WHO declared the end of the Ebola outbreak in Nigeria on 20 October 2014 (http://www.who.int/mediacentre/news/statements/2014/nigeria-ends-ebola/en/). Only a new *confirmed case will count; cases reported as ""suspected"" during the question's open period will not count even if they are ""confirmed"" after the question's close date. Where a person contracts Ebola is irrelevant for the resolution of this question; however, patients who are confirmed or suspected of having Ebola elsewhere and are transported to Nigeria for treatment or observation will not count. Outcome will be determined either by the World Health Organization (e.g., http://www.who.int/csr/don/archive/disease/ebola/en/), the UN Mission for Ebola Emergency Response (e.g., http://www.un.org/ebolaresponse/index.shtml, the government of Nigeria (e.g., http://www.health.gov.ng/index.php/news-media/press-releases), or by reporting from credible open source media (e.g., Reuters, BBC, AP).","true",5,date,"2014-12-10","2015-12-31","",active,"2014-12-10 13:00:00","2015-06-15 06:00:00",,
"1480","When will Russia **officially withdraw from the Intermediate-Range Nuclear Forces (INF) Treaty?","The United States accused Russia of violating the INF, a 1987 agreement between the US and the USSR, in July 2014 (http://www.nytimes.com/2014/07/29/world/europe/us-says-russia-tested-cruise-missile-in-violation-of-treaty.html, http://www.armscontrol.org/factsheets/INFtreaty). The question will resolve as ""yes"" based either on news that Russia has **officially announced its plans to withdraw, or news of Russia's actual withdrawal from the treaty. Outcome will be determined by credible open source media reporting (e.g., Reuters, BBC, AP) or **official announcements.","true",5,date,"2014-12-10","2015-12-31","",active,"2014-12-10 13:00:00","2015-06-15 06:00:00",,
"1482","When will Jordan experience an episode of **significant domestic political unrest?","This is a ""fuzzy set"" question. For more information on fuzzy set questions, see https://www.goodjudgmentproject.com/clarifications/fsq0.html. For specific information on what constitutes an episode of **significant domestic political unrest, please visit: https://www.goodjudgmentproject.com/clarifications/fsq1.html. ","true",5,date,"2014-12-10","2015-12-31","",active,"2014-12-10 13:00:00","2015-06-15 06:00:00",,
"1481","How many *new countries will confirm cases of the H5N8 virus **between 10 December 2014 and 1 April 2015?","H5N8 is a type of bird flu, the most recent strain of which has emerged in Europe, that could cause serious economic losses for the industry and could potentially pose a threat to public health (http://www.reuters.com/article/2014/11/18/us-health-birdflu-britain-idUSKCN0J21N320141118). *New countries refer to those other than the UK, the Netherlands, Germany, as well as South Korea, Japan, and China, where cases have been reported throughout 2014. Outcome will be determined by credible open source media reporting (e.g., Reuters, BBC, AP) or data from the World Organisation for Animal Health (http://www.oie.int/en/animal-health-in-the-world/update-on-avian-influenza/2014/). If the resolution criteria are not met, GJP will assume the following as the ""status quo"" outcome: no *new countries have confirmed cases of the H5N8 virus during the question's open period.","false",4,number,"0","6","countries",closed,"2014-12-11 04:00:00","2015-06-15 06:00:00","2014-12-11 04:00:00","6.0"
"1484","What will be the change in world economic output for 2014, according to the International Monetary Fund's April 2015 World Economic Outlook report?","A poll of international investors showed that 38% of those surveyed see the global economy as worsening (http://www.bloomberg.com/news/2014-11-13/world-outlook-darkening-as-89-in-poll-see-europe-deflation-risk.html). The question will be resolved based on information provided in the first row of Table A1 of the International Monetary Fund's first World Economic Outlook (WEO) report published in 2015. WEO is routinely published in April and October of each year, and the April version includes estimates of annual change in output (year-over-year) for the preceding year. The October 2014 report can be seen here: http://www.imf.org/external/Pubs/ft/weo/2014/02/pdf/text.pdf. ","false",5,number,"2.8","3.8","%",closed,"2015-01-07 13:00:00","2015-06-15 06:00:00","2015-01-07 13:00:00","3.4"
"1485","When will Venezuela default on its foreign-currency debt?","Plummeting oil prices are threatening the country's main source of revenue, and Venezuela has already defaulted on much of its domestic debt (http://www.businessweek.com/articles/2014-12-18/venezuela-default-likely-according-to-markets, http://www.bloomberg.com/news/2015-01-04/maduro-travels-to-china-for-financing-opec-nations-for-oil-plan.html). A country is generally considered in default when it fails to pay out, in full, its matured bonds. Outcome will be determined by credible open source media reporting (e.g., Reuters, BBC, AP) or **official announcements.","true",5,date,"2015-01-07","2015-06-11","",active,"2015-01-07 13:00:00","2015-06-15 06:00:00",,
"1486","When will Cuba next experience an episode of **significant domestic political unrest?","This is a ""fuzzy set"" question. For more information on fuzzy set questions, see https://www.goodjudgmentproject.com/clarifications/fsq0.html. For specific information on what constitutes an episode of **significant domestic political unrest, please visit: https://www.goodjudgmentproject.com/clarifications/fsq1.html. ","true",5,date,"2015-01-07","2015-12-31","",active,"2015-01-07 13:00:00","2015-06-15 06:00:00",,
"1487","When will there next be a **lethal confrontation between **national military forces in the East China Sea?","In mid-December, two Chinese naval vessels were reported to have come within 44 miles of the Diaoyu/Senkaku islands, the closest approach since the dispute erupted in 2012 (http://sinosphere.blogs.nytimes.com/2015/01/01/china-japan-dispute-over-islands-spreads-to-cyberspace/?_r=0). For more information on the East China Sea, as well as a map of disputed territories, see: http://www.cfr.org/Asia-and-pacific/chinas-maritime-disputes/p31345. Outcome will be determined by credible open source media reporting (e.g., Reuters, BBC, AP). ","true",5,date,"2015-01-07","2015-12-31","",active,"2015-01-07 13:00:00","2015-06-15 06:00:00",,
"1488","When will the end-of-day U.S. dollar-Russian ruble exchange rate next close at 45.00 or below?","The ruble lost more than 40% against the dollar in 2014 (http://www.wsj.com/articles/ruble-falls-on-first-trading-day-of-2015-1420466328). Outcome will be determined by the end-of-day closing value reported by Bloomberg, at http://www.bloomberg.com/quote/usdrub:cur. For historical trends, see http://www.bloomberg.com/quote/usdrub:cur/chart. In case of delayed reporting or problems with the Bloomberg website, reporting by other credible open sources may be used.","true",5,date,"2015-01-07","2015-06-11","",active,"2015-01-07 13:00:00","2015-06-15 06:00:00",,
"1489","When will Russia and China hold joint naval exercises in the Mediterranean Sea?","Moscow appears to be aiming to solidify closer military, political, and industrial cooperation with China (http://www.defensenews.com/story/defense/commentary/2015/01/03/thought-leaders-russia/21190035/, http://news.usni.org/2014/11/20/russia-china-hold-2015-naval-exercises-mediterranean-pacific). The naval exercises must commence for a ""yes"" resolution. Outcome will be determined by credible open source media reporting (e.g., Reuters, BBC, AP).","true",5,date,"2015-01-14","2015-06-11","",closed,"2015-01-14 13:00:00","2015-06-15 06:00:00","2015-01-14 13:00:00","2015-05-11 06:00:00"
"1490","When will the People's Bank of China next reach a bilateral currency swap **agreement with the United States Federal Reserve?","The People's Bank of China has negotiated around 25 bilateral currency swap agreements with central banks around the world, making it easier for the partners to conduct cross-border trade and direct investment in renminbi (http://blogs.wsj.com/moneybeat/2013/10/10/qa-whats-a-currency-swap-line/, http://www.ft.com/intl/cms/s/0/d79001d8-10b8-11e4-812b-00144feabdc0.html, http://www.bloomberg.com/news/2014-10-13/russia-china-sign-currency-swap-agreement-to-double-100b-trade.html). The time frame of the swaps in such agreements is irrelevant (e.g., both temporary liquidity swap lines and long term swap lines would count); however, interest rate swaps would not qualify. Outcome will be determined by credible open source media reporting (e.g., Reuters, BBC, AP) or **official announcements. ","true",5,date,"2015-01-14","2015-12-31","",active,"2015-01-14 13:00:00","2015-06-15 06:00:00",,
"1492","When will the government of Myanmar **officially sign a ceasefire agreement with the Nationwide Ceasefire Coordination Team?","The government's Union Peacemaking Work Committee (UPWC) and the rebels' Nationwide Ceasefire Coordination Team (NCCT), have resumed negotiations toward a nationwide ceasefire agreement (http://www.rfa.org/english/news/myanmar/peace-talks-continue-12172014145729.html, http://www.mmpeacemonitor.org/stakeholders/myanmar-peace-center/192-ncct). Membership changes to the NCCT, or an official name change, will not affect the resolution of the question. If the NCCT disbands the question will close as ""no."" Outcome will be determined by credible open source media reporting (e.g., Reuters, BBC, AP).","true",5,date,"2015-01-14","2015-06-11","",active,"2015-01-14 13:00:00","2015-06-15 06:00:00",,
"1493","When will Petrobras report its earnings for the third quarter of 2014? ","Brazil's state-controlled oil producer, Petrobras, has violated its bond terms by failing to report its earnings; this could lead to the company being declared in technical default (http://www.reuters.com/article/2014/12/29/us-brazil-petrobras-bonds-idUSKBN0K71JB20141229, http://www.reuters.com/article/2015/01/06/brazil-petrobras-creditors-idUSE6N0RP03E20150106). Outcome will be determined by credible open source media reporting (e.g., Reuters, BBC, AP).","true",5,date,"2015-01-14","2015-06-11","",closed,"2015-01-14 13:00:00","2015-07-15 06:00:00","2015-01-14 13:00:00","2015-01-28 06:00:00"
"1491","How many countries will **officially submit a claim to the North Pole to the United Nations **between 14 January and 9 June 2015?","In December, Denmark submitted its official claim to the North Pole to the UN; Russia and Canada are angling to do the same (http://www.ft.com/intl/cms/s/0/b7e66b1c-8442-11e4-8cc5-00144feabdc0.html, http://www.adn.com/article/20141217/russia-follow-denmark-arctic-shelf-claim-march). Outcome will be determined by credible open source media reporting (e.g., Reuters, BBC, AP), **official announcements, or the UN Commission on the Limits of the Continental Shelf (http://www.un.org/depts/los/clcs_new/commission_submissions.htm). ","false",4,number,"0","6","countries",active,"2015-01-14 13:00:00","2015-06-15 06:00:00",,
"1494","When will there next be an **attack carried out by Islamist militants in France, the UK, Germany, the Netherlands, Denmark, Spain, Portugal, or Italy?","The attack on the French newspaper Charlie Hebdo has set France on edge at a time when Islamist militant activity has become a central concern of security officials across Europe (http://www.bbc.com/news/world-europe-30710883; http://www.reuters.com/article/2015/01/11/us-france-shooting-idUSKBN0KK05S20150111). Individual acts of violence perpetrated by non-state actors (e.g., the use of explosive devices, projectiles, or knives) would count. Attribution and outcome will be determined by credible open source media reporting (e.g., Reuters, BBC, AP). In cases of substantial controversy or uncertainty, Administrator reserves the right to consult outside experts about how to proceed and/or void the question.","true",5,date,"2015-01-21","2015-12-31","",closed,"2015-01-21 13:00:00","2015-06-15 06:00:00","2015-01-21 13:00:00","2015-02-03 06:00:00"
"1495","When will a new round of family reunions between North and South Korea begin?","South Korean President Park Geun-hye has proposed holding another round of reunions among families separated by the Korean War (http://www.koreatimes.co.kr/www/news/nation/2015/01/116_171585.html). The reunions must commence for a ""yes"" resolution. Outcome will be determined by credible open source media reporting (e.g., Reuters, BBC, AP). ","true",5,date,"2015-01-21","2015-06-11","",active,"2015-01-21 13:00:00","2015-06-15 06:00:00",,
"1496","When will South Korean President Park Geun-hye or any South Korean *cabinet minister next meet with **official North Korean representatives?","South Korean Unification Minister Ryoo Kihl-jae has continued to push for high-level talks between the North and South; in Kim Jong-Un's New Years' address, he expressed an openness to a high-level dialogue (http://www.newsweek.com/are-north-and-south-korea-heading-talks-298897, http://www.bbc.com/news/world-asia-30621112). *South Korean cabinet ministers are listed here: http://www.korea.net/Government/Administration/Cabinet. Outcome will be determined by credible open source media reporting (e.g., Reuters, BBC, AP). If the resolution criteria are not met, GJP will assume the following as the ""status quo"" outcome: Neither President Park nor any South Korean *cabinet minister has met with **official North Korean representatives during the question's open period.","true",5,date,"2015-01-21","2015-12-31","",active,"2015-01-21 13:00:00","2015-06-15 06:00:00",,
"1497","When will Iran next experience an episode of **significant domestic political unrest?","This is a ""fuzzy set"" question. For more information on fuzzy set questions, see https://www.goodjudgmentproject.com/clarifications/fsq0.html. For specific information on what constitutes an episode of **significant domestic political unrest, please visit: https://www.goodjudgmentproject.com/clarifications/fsq1.html.","true",5,date,"2015-01-21","2015-12-31","",active,"2015-01-21 13:00:00","2015-06-15 06:00:00",,
"1498","How many seats will the Conservative party hold in the UK House of Commons after the 7 May 2015 **elections?","The British general elections are scheduled for 7 May 2015 (http://www.theguardian.com/politics/2014/dec/27/2015-general-election-unpredictable-green-party-ukip). The question will resolve when official election results are definitively reported in open source media (e.g., Reuters, BBC, AP). If the election is delayed indefinitely or cancelled, or in other cases of substantial controversy or uncertainty, Administrator reserves the right to consult outside experts about how to proceed and/or void the question.","false",5,number,"230","320","seats",closed,"2015-01-21 13:00:00","2015-06-15 06:00:00","2015-01-21 13:00:00","331.0"
"1499","When will a unity government be formed in Libya?","U.N.-sponsored talks between rival Libyan factions aim to form a unity government (http://www.nytimes.com/2015/01/19/world/middleeast/libya-militias-agree-to-halt-in-fighting-with-caveats.html). The specific composition of the unity government will not affect the outcome of this question. Outcome will be determined by credible open source media reporting (e.g., Reuters, BBC, AP) or **official announcements.","true",5,date,"2015-01-21","2015-12-31","",active,"2015-01-21 13:00:00","2015-06-15 06:00:00",,
"1500","When will **Standard and Poor's downgrade Greece's sovereign credit rating?","Standard and Poor's has threatened to downgrade Greece's credit rating, currently B, even before its next planned review in mid-March (http://www.reuters.com/article/2015/01/26/uk-greece-rating-s-p-idUKKBN0KZ1O120150126). Outcome will be determined by Standard and Poor's (e.g., http://www.standardandpoors.com/en_US/web/guest/ratings/press-releases) or credible open source media reporting of S&P data (e.g., Reuters, BBC, AP).","true",5,date,"2015-02-04","2015-06-11","",closed,"2015-02-04 13:00:00","2015-06-15 06:00:00","2015-02-04 13:00:00","2015-02-06 06:00:00"
"1502","When will there next be a **lethal confrontation between Saudi **national military forces and Yemen's Houthis?","The recent upheaval in Yemen has intensified Saudi Arabian concerns about its neighbor's destabilization (http://www.reuters.com/article/2015/01/26/us-saudi-succession-yemen-idUSKBN0KZ0TF20150126, http://www.defensenews.com/story/defense/policy-budget/leaders/2015/01/25/united-arab-emirates-yemen-defense/22215363/). Cross-border confrontations will count if the threshold for a **lethal confrontation is met, including those inadvertently involved (e.g., civilians). For the purposes of this question, **national military forces include law enforcement forces and/or border guards. A **lethal confrontation involving a multinational force that includes Saudi **national military forces will count. Outcome will be determined by credible open source media reporting (e.g., Reuters, BBC, AP).","true",5,date,"2015-02-04","2015-12-31","",closed,"2015-03-04 13:00:00","2015-06-15 06:00:00","2015-03-04 13:00:00","2015-03-26 07:00:00"
"1503","**Between 4 February and 30 April 2015, what will be the lowest end-of-day spot price per dry metric ton of 62% Fe iron ore?","The spot price of iron ore continues to fall to historic lows (http://www.wsj.com/articles/iron-ore-copper-keep-heading-down-1422562214, http://www.reuters.com/article/2015/01/29/column-russell-ironore-asia-idUSL4N0V81RD20150129). Outcome will be determined by the Wall Street Journal's Market Data Center price for ""Iron Ore 62% Fe CFR China-S"" at http://online.wsj.com/mdc/public/page/2_3023-cashprices.html, which publishes prices from The Steel Index on a one-day delay. In case of further-delayed reporting or problems with the WSJ Market Data Center, credible open source coverage of The Steel Index data may be used.","false",5,number,"50","75","$/DMT",closed,"2015-02-04 13:00:00","2015-06-15 06:00:00","2015-02-04 13:00:00","46.7"
"1504","When will it be **officially announced that any country is exiting the eurozone or the European Union?","Contentious domestic politics and growing financial crises could lead to the exit of countries from the eurozone or the EU itself (http://www.bbc.com/news/business-30680415, http://www.wsj.com/articles/europe-file-eurozone-may-not-blink-first-in-confrontation-with-greece-1422488136). The exit does not need to take effect to resolve the question. **Official announcements from any EU member state or any EU governing body will suffice. Outcome will be determined by credible open source media reporting (e.g., Reuters, BBC, AP).","true",5,date,"2015-02-04","2015-12-31","",active,"2015-02-04 13:00:00","2015-06-15 06:00:00",,
"1505","When will Ethiopia experience an episode of **sustained domestic armed conflict?","This is a ""fuzzy set"" question. For more information on fuzzy set questions see https://www.goodjudgmentproject.com/clarifications/fsq0.html. For specific information on what constitutes an episode of **sustained domestic armed conflict, please visit: https://www.goodjudgmentproject.com/clarifications/fsq2.html.","true",5,date,"2015-02-04","2015-12-31","",active,"2015-02-04 13:00:00","2015-06-15 06:00:00",,
