"1437","When will the Mangyongbong-92 **officially resume transit between North Korea and Japan?","The Mangyongbong-92 is a North Korean passenger ferry that has been banned from entry into Japanese ports since 2006 (http://bigstory.ap.org/article/north-korean-ship-symbolizes-hopes-japan-ties). Outcome will be determined by credible open source media reporting (e.g., Reuters, BBC, AP) or **official announcements. There must be evidence that both North Korea and Japan have agreed on the ferry **officially resuming transit.","false",5,date,"2014-09-24","2015-06-11","",active,"2014-09-24 13:00:00","2015-06-30 06:00:00",,
"1438","When will Russia next *initiate a World Trade Organization (WTO) dispute against the European Union, Canada, or the United States?","Russian officials have complained that sanctions imposed since spring 2014 by the EU, Canada, and the US violate the principles of the WTO, and have hinted at filing a dispute in protest of those sanctions (http://www.reuters.com/article/2014/09/18/us-ukraine-crisis-putin-idUSKBN0HD17V20140918). *Initiation of a dispute would be evidenced by a formal request for WTO consultations. The outcome of those consultations is irrelevant. Outcome will be determined by credible open source media reporting (e.g., Reuters, BBC, AP), **official announcements, or the WTO's Russia page at http://www.wto.org/english/thewto_e/countries_e/russia_e.htm.","true",4,date,"2014-09-24","2015-12-31","",active,"2014-09-24 13:00:00","2015-06-15 06:00:00",,
"1439","By how much will Brazil's *economy grow in 2014, in percentage terms, relative to 2013?","Brazil's GDP growth forecast has been steadily revised downward (http://www.reuters.com/article/2014/09/22/brazil-economy-idUSE4N0ON01Z20140922). *Economic growth refers to year over year growth in real GDP. Outcome will be determined by official GDP data from Brazil or credible open source media coverage (e.g., Reuters, BBC, AP) of that data.","false",5,number,"-0.5","2","%",closed,"2014-09-24 13:00:00","2015-06-14 06:00:00","2014-09-24 13:00:00","0.1"
"1440","When will Mahmoud Abbas **vacate the office of President of the Palestinian Authority?","Palestinian Authority President Mahmoud Abbas' political clout has been challenged after the most recent crisis in Gaza (http://www.reuters.com/article/2014/09/18/us-palestinians-successor-insight-idUSKBN0HD19720140918, http://www.nytimes.com/2014/08/26/world/middleeast/abbas-seen-as-ready-to-seek-mideast-pact-on-his-own.html). Outcome will be determined by credible open source media reporting (e.g., Reuters, BBC, AP) or **official announcements.","true",5,date,"2014-09-24","2015-06-11","",active,"2014-09-24 13:00:00","2015-06-11 06:00:00",,
"1441","When will the United Kingdom **officially appoint an ambassador to Iran?","In June 2014, the UK officially announced that its embassy in Tehran would be reopened after closing in November 2011 following an attack by protestors (http://www.bbc.com/news/uk-politics-27882932). While the UK and Iran agreed on the appointment of non-resident charges d'affaires in October 2013, only an appointment at the ambassadorial level will count for the purposes of this question (https://www.gov.uk/government/news/appointment-of-uk-non-resident-charge-daffaires-to-iran). Outcome will be determined by credible open source media reporting (e.g., Reuters, BBC, AP) or the UK's embassy website (https://www.gov.uk/government/world/organisations/uk-for-iranians).","true",5,date,"2014-09-24","2015-12-31","",active,"2014-09-24 13:00:00","2015-06-15 06:00:00",,
"1442","When will the World Health Organization next report any *confirmed cases of Ebola in a European Union member state?","Outcome will be determined by the World Health Organization's outbreak news page for Ebola, at http://www.who.int/csr/don/archive/disease/ebola/en/. European patients whose cases of Ebola have been confirmed as part of the outbreak in West Africa and are transported back to Europe for treatment will not count. *Cases reported as ""suspected"" prior to the question's close date will not count, even if they are ""confirmed"" after the question's close date. For a list of EU member states, see http://europa.eu/about-eu/countries/member-countries/index_en.htm.","false",5,date,"2014-09-24","2015-12-31","",closed,"2014-09-24 13:00:00","2015-06-15 06:00:00","2014-09-24 13:00:00","2014-10-09 06:00:00"
"1443","When will the Islamic State **attack Bahrain, Jordan, Qatar, Saudi Arabia, or the United Arab Emirates?","Bahrain, Jordan, Qatar, Saudi Arabia, and the United Arab Emirates have joined the United States in carrying out airstrikes in Syria against the Islamic State (IS), also known as ISIL or ISIS (http://www.bbc.com/news/world-middle-east-29321136). For the purposes of this question, **attacks could include individual acts of violence (e.g., the use of improvised explosive devices or suicide bombings). Changes in Islamic State's name or composition are irrelevant, so long as the group does not disband entirely; an official successor group will count, but affiliated groups, and groups or individuals claiming to be inspired by IS, will not. **Attacks on the relevant countries' embassies in Iraq or Syria would not count. The execution of captured citizens from the relevant countries would not, in the absence of an **attack, be sufficient for a ""yes"" resolution. Outcome will be determined by credible open source media reporting (e.g., Reuters, BBC, AP).","true",5,date,"2014-10-01","2015-12-31","",closed,"2014-10-01 13:00:00","2015-06-15 06:00:00","2014-10-01 13:00:00","2014-11-03 06:00:00"
"1444","When will a trilateral meeting take place between Chinese President Xi Jinping, Japanese Prime Minister Shinzo Abe, and South Korean President Park Geun-hye?","A trilateral meeting of heads of state from China, Japan, and South Korea was held annually from 2008 to 2012, but regional tensions led to its cancellation; officials have recently discussed resuming a formal meeting at the head of state level (http://www.bloomberg.com/news/2014-09-26/abe-calls-for-unconditional-summit-with-china-in-november.html). Outcome will be determined by credible open source media reporting (e.g., Reuters, BBC, AP).","true",5,date,"2014-10-01","2015-06-11","",active,"2014-10-01 13:00:00","2015-06-15 06:00:00",,
"1445","What will be the highest end-of-day close for the U.S. dollar-Chinese renminbi exchange rate **between 1 October 2014 and 1 February 2015?","Outcome will be determined by the highest end-of-day closing value reported by Bloomberg, at http://www.bloomberg.com/quote/usdcny:cur. For historical trends, see http://www.bloomberg.com/quote/usdcny:cur/chart. In case of delayed reporting or problems with the Bloomberg website, reporting by other credible open sources may be used. ","false",5,number,"6.05","6.4","USD/CNY",closed,"2014-10-01 13:00:00","2015-06-15 06:00:00","2014-10-01 13:00:00","6.2556"
"1446","When will Russia **officially lift its embargo on food imports from the US, the EU, Canada, Australia or Norway?","In retaliation for Western sanctions, Russia has imposed an embargo on food imports from the US, the EU, Canada, Australia, and Norway. The embargo could potentially cost the European Union 5 billion euros (http://www.reuters.com/article/2014/09/03/ukraine-crisis-russia-embargo-idUSL5N0R44HB20140903) and have considerable impacts on several U.S. industries (http://www.washingtonpost.com/blogs/wonkblog/wp/2014/08/07/russias-ban-on-american-food-imports-is-going-to-hit-the-u-s-poultry-pork-and-nut-industries-the-hardest/). **Officially lifting the embargo on a subset of banned foods or specific industries from either the US, the EU, Canada, Australia, or Norway would be sufficient. Outcome will be determined by credible open source media reporting (e.g., Reuters, BBC, AP) or **official announcements.","true",5,date,"2014-10-01","2015-06-11","",active,"2014-10-01 13:00:00","2015-06-15 06:00:00",,
"1447","When will construction on the Nicaragua canal begin?","A ""yes"" resolution requires physical work to begin on some portion of the Nicaragua Canal itself. Physical work refers to, for example, on-site excavation or construction, which is distinct from planning, surveying, or the manufacturing or delivery of materials (http://www.theguardian.com/global-development/2014/sep/30/nicaragua-canal-forest-displace-people). Outcome will be determined by credible open source media reporting (e.g., Reuters, BBC, AP).","true",5,date,"2014-10-01","2015-06-11","",voided,"2014-10-01 13:00:00","2015-06-15 06:00:00",,
"1448","When will Hong Kong Chief Executive Leung Chun-ying **vacate office?","Mr. Leung has become a target of the recent protests in Hong Kong, particularly as talks between the government and protest leaders have broken down (http://www.nytimes.com/2014/10/02/world/asia/for-hong-kong-leader-pressure-builds-from-both-sides.html, http://www.washingtonpost.com/world/asia_pacific/hong-kong-government-backs-out-of-talks-students-vow-new-protests/2014/10/09/db79d8fe-4fb6-11e4-babe-e91da079cb8a_story.html). Outcome will be determined by credible open source media reporting (e.g., Reuters, BBC, AP).","false",5,date,"2014-10-15","2015-12-31","",active,"2014-10-15 13:00:00","2015-06-15 06:00:00",,
"1448","When will Hong Kong Chief Executive Leung Chun-ying **vacate office?","Mr. Leung has become a target of the recent protests in Hong Kong, particularly as talks between the government and protest leaders have broken down (http://www.nytimes.com/2014/10/02/world/asia/for-hong-kong-leader-pressure-builds-from-both-sides.html, http://www.washingtonpost.com/world/asia_pacific/hong-kong-government-backs-out-of-talks-students-vow-new-protests/2014/10/09/db79d8fe-4fb6-11e4-babe-e91da079cb8a_story.html). Outcome will be determined by credible open source media reporting (e.g., Reuters, BBC, AP).","false",5,date,"2014-10-15","2015-12-31","",voided,"2014-10-15 13:00:00","2015-06-15 06:00:00",,
"1449","When will the People's Armed Police or the People's Liberation Army respond to protests in Hong Kong?","Should protests continue, some fear China may respond by dispatching the People's Armed Police (PAP) or the People's Liberation Army (PLA) to intervene (http://warontherocks.com/2014/10/the-hong-kong-countdown/, http://www.janes.com/article/44110/pla-tools-up-in-hong-kong). Only PAP and PLA forces in uniform will count. Outcome will be determined by credible open source media reporting (e.g., Reuters, BBC, AP).","false",5,date,"2014-10-15","2015-12-31","",active,"2014-10-15 13:00:00","2015-06-15 06:00:00",,
"1450","When will OPEC next agree to cut its oil output?","Falling oil prices have led to speculation that the Organization of the Petroleum Exporting Countries (OPEC) might collectively cut oil output for the first time in six years on or before their 27 November 2014 meeting (http://www.nytimes.com/2014/10/14/business/energy-environment/oil-prices-fall-as-opec-members-fight-for-market-share.html, http://www.vox.com/2014/10/7/6934819/oil-prices-falling-russia-OPEC-shale-boom-gasoline-prices). Output cuts do not need to take effect for a ""yes"" resolution. Outcome will be determined by credible open source media reporting (e.g., Reuters, BBC, AP) or **official announcements.","true",5,date,"2014-10-15","2015-06-11","",active,"2014-10-15 13:00:00","2015-06-15 06:00:00",,
"1451","When will the Foreign Secretaries from India and Pakistan next hold **official talks?","Indian-Pakistani fighting along the border has recently been at its worst in a decade, despite pledges by both countries to uphold a cease-fire (http://blogs.wsj.com/indiarealtime/2014/10/13/india-pakistan-border-firing-tapers-off-but-diplomatic-tempers-continue-to-flare/, http://www.washingtonpost.com/world/asia_pacific/india-pakistan-exchange-fire-over-kashmir-border/2014/10/07/5a8baf2c-4e00-11e4-877c-335b53ffe736_story.html). In August 2014, India called off talks between the countries' foreign secretaries (http://www.bbc.com/news/world-asia-28832477, http://online.wsj.com/articles/india-cancels-planned-talks-with-pakistan-1408377467). Outcome will be determined by credible open source media reporting (e.g., Reuters, BBC, AP).","true",5,date,"2014-10-15","2015-06-11","",closed,"2014-10-15 13:00:00","2015-06-15 06:00:00","2014-10-15 13:00:00","2015-03-03 06:00:00"
"1454","What GDP growth rate will Germany **officially report for the third quarter of 2014?","By placing an emphasis on austerity measures to balance the budget, Germany's economic growth has slowed (http://www.reuters.com/article/2014/10/20/germany-economy-bundesbank-idUSL6N0SF28K20141020, http://www.nytimes.com/2014/10/10/business/international/as-growth-in-germany-fades-merkel-hints-at-a-shift-in-economic-policy.html). *Data for Germany's quarter-on-quarter, seasonally adjusted, real GDP growth can be found in the last column of the GDP chart from the German Federal Statistical Office (https://www.destatis.de/EN/FactsFigures/Indicators/ShortTermIndicators/NationalAccounts/kvgr111.html). Outcome will be determined by the official German data referenced above; data for the third quarter will be released by the German Federal Statistical office in mid-November (https://www.destatis.de/EN/Meta/abisz/BIP_e.html).","false",4,number,"-0.8","0.8","%",closed,"2014-10-22 13:00:00","2014-11-14 06:00:00","2014-10-22 13:00:00","0.1"
"1455","When will Iran next host a *head of state from one of the G8 countries or China on an official visit?","Iran has increasingly been engaging with the rest of the world, including participating in talks on the state of the country's nuclear program and seeking membership in the Shanghai Cooperation Organization (http://www.newyorker.com/news/news-desk/irans-dinner-diplomacy, http://thediplomat.com/2014/09/the-new-improved-shanghai-cooperation-organization/). *Heads of state from the G8 countries or China refer to the following people or their successors: Prime Minister Stephen Harper (Canada), President Francois Hollande (France), Chancellor Angela Merkel (Germany), Prime Minister Mateo Renzi (Italy), Prime Minister Shinzo Abe (Japan), Prime Minister David Cameron (United Kingdom), President Barack Obama (United States), President Vladimir Putin (Russia), or President Xi Jinping (China). Outcome will be determined by credible open source media reporting (e.g., Reuters, BBC, AP).","true",5,date,"2014-10-22","2015-12-31","",active,"2014-10-22 13:00:00","2015-06-15 06:00:00",,
"1456","By how much will Chinese power consumption *grow in 2014?","Chinese power consumption is used as an indicator of economic growth (http://blogs.wsj.com/chinarealtime/2014/01/20/what-chinas-electricity-usage-says-about-growth/). Outcome will be determined by *data for percent change, year-on-year, in power consumption for January to December 2014 from the Chinese National Energy Administration, or credible open source media reporting of such data (e.g., Reuters [http://www.reuters.com/article/2014/10/20/china-power-consumption-idUKL3N0SB36Q20141020], BBC, AP).","false",4,number,"2","8","%",closed,"2014-10-22 13:00:00","2015-06-15 06:00:00","2014-10-22 13:00:00","3.8"
"1457","When will a *no-fly zone over any part of Syria be **officially announced?","Turkey has been pushing for a no-fly zone over Syria as part of the fight against the Islamic State (IS), also known as ISIL or ISIS (http://www.nytimes.com/2014/09/27/world/middleeast/us-considers-a-no-fly-zone-to-protect-civilians-from-airstrikes-by-syria-.html, http://www.reuters.com/article/2014/10/20/us-mideast-crisis-syria-un-idUSKCN0I91O720141020). *A no-fly zone is an area over which aircraft are not permitted to fly. Any no-fly zone over Syria, whether over the whole country or merely part of the country, would count. In addition, a no-fly zone applying only to the aircraft of specific countries or groups and a no-fly zone announced as part of a broader ""buffer zone"" or a ""safe zone"" would count for a ""yes"" resolution. However, a no-fly zone announced by either the Syrian government or the Islamic State would not count. Outcome will be determined by credible open source media reporting (e.g., Reuters, BBC, AP).","true",5,date,"2014-10-22","2015-12-31","",active,"2014-10-22 13:00:00","2015-06-15 06:00:00",,
"1459","When will Goodluck Jonathan **vacate the office of President of Nigeria?","Besides presidential elections upcoming in February 2015, Nigeria's incumbent president Goodluck Jonathan faces a number of political challenges at home (http://www.bloomberg.com/news/2014-10-15/nigeria-s-old-political-faces-resurface-as-opposition-contenders.html, http://www.nytimes.com/2014/10/24/world/africa/boko-harm-abducts-more-women-despite-claims-of-nigeria-cease-fire.html). Outcome will be determined by credible open source media reporting (e.g., Reuters, BBC, AP) or **official announcements.","true",5,date,"2014-10-29","2015-12-31","",active,"2014-10-29 14:00:00","2015-06-15 06:00:00",,
"1460","What will the average global temperature (in degrees Celsius) be in 2014?","Following the warmest summer on record, with August and September 2014 also both setting temperature records, the U.S. National Oceanic and Atmospheric Administration (NOAA)'s National Climatic Data Center suggests that 2014 could end up being the warmest year on record (http://www.washingtonpost.com/blogs/capital-weather-gang/wp/2014/10/20/after-record-warm-september-2014-is-on-track-to-warmest-year-noaa-says/, http://www.climatecentral.org/news/2014-on-track-to-be-warmest-year-18205). Outcome will be determined by NOAA (http://www.ncdc.noaa.gov/sotc/) and NASA (http://data.giss.nasa.gov/gistemp/tabledata_v3/GLB.Ts+dSST.txt) or credible open source media reporting of NOAA and NASA data (e.g., Reuters, BBC, AP). The question will remain open until relevant data are released.","false",5,number,"14","15","ºC",closed,"2014-10-29 14:00:00","2015-01-16 03:00:00","2014-10-29 14:00:00","14.59"
"1461","When will there next be a *significant **lethal confrontation between **national military forces from Iran and Pakistan?","Continued border skirmishes have raised questions about whether the dispute between Iran and Pakistan will escalate; diplomats have committed to increasing border control but the situation on the ground remains tenuous (http://www.bbc.com/news/world-middle-east-29752647, http://www.dawn.com/news/1140773/pakistan-iran-to-strengthen-border-control). A *significant **lethal confrontation would be considered a clash involving both the **national military forces of Iran and the **national military forces of Pakistan (including their respective border guards and members of law enforcement) in which 15 or more fatalities are reported. Any fatalities resulting from the confrontation would count, including the actors directly involved as well as others indirectly involved (e.g., civilians, militias). Outcome will be determined by credible open source media reporting (e.g., Reuters, BBC, AP).","true",5,date,"2014-10-29","2015-12-31","",active,"2014-10-29 14:00:00","2015-06-15 06:00:00",,
"1462","When will Iraq's parliament approve the creation of an Iraqi National Guard?","A plan to create an Iraqi National Guard is a US-backed project to integrate tribal militias into a fighting force to counter the growing threat from the Islamic State; Prime Minister Abadi submitted the idea to Parliament as part of his plan of action in mid-October (http://www.al-monitor.com/pulse/originals/2014/09/iraq-national-guard-sunni-militias.html, http://online.wsj.com/articles/u-s-backed-plan-for-iraqi-national-guard-unraveling-1413493028, http://www.bloomberg.com/news/2014-10-13/sunni-reawakening-in-iraq-hinges-on-national-guard.html). Outcome will be determined by credible open source media reporting (e.g., Reuters, BBC, AP) or **official announcements.","true",5,date,"2014-10-29","2015-12-31","",active,"2014-10-29 14:00:00","2015-06-15 06:00:00",,
"1463","When will Iran release Jason Rezaian?","For details of the case involving Jason Rezaian, the Washington Post correspondent being held in Iran, see http://www.washingtonpost.com/world/middle_east/iranian-official-washington-post-journalist-could-be-freed-in-less-than-a-month/2014/11/06/f37a4092-65be-11e4-bb14-4cfea1e742d5_story.html and http://www.washingtonpost.com/world/national-security/washington-post-reporter-facing-interrogation-iranian-official-says/2014/09/17/b9b4f2b4-3e98-11e4-9587-5dafd96295f0_story.html. For a ""yes"" resolution, Rezaian must be released from custody and have the ability to leave the country. Outcome will be determined by credible open source media reporting (e.g., Reuters, BBC, AP).","true",5,date,"2014-11-12","2015-06-11","",active,"2014-11-12 13:00:00","2015-06-15 06:00:00",,
"1464","When will the spot price of iron ore next fall below $71.00 per ton?","With prices already at a five-year low, there is worry that oversupply will drive prices even lower (http://www.smh.com.au/business/mining-and-resources/chinese-traders-tip-iron-ore-to-hit-us70-20141106-11hwam.html, http://www.bloomberg.com/news/2014-11-07/vale-says-global-iron-ore-market-won-t-be-oversupplied-forever.html). Outcome will be determined by the lowest iron ore spot price reported in credible open source media (e.g., Reuters, BBC, AP).","true",5,date,"2014-11-12","2015-06-01","",closed,"2014-11-12 13:00:00","2015-06-15 06:00:00","2014-11-12 13:00:00","2014-11-19 06:00:00"
"1465","When will **national or **multinational military forces *intervene against the Forces Démocratiques de Libération du Rwanda (FDLR) in the Democratic Republic of Congo?","Defense and foreign ministers from the Great Lakes and Southern African regions resolved in late October 2014 that military action could be taken against the Forces Démocratiques de Libération du Rwanda (FDLR) in the Democratic Republic of Congo (DRC) if the group does not disarm and surrender by January 2015 (http://allafrica.com/stories/201410211526.html). *An intervention would be a national- or supranational-level political decision to use **national military forces, whether alone or as part of a **multinational force, to end the FDLR's insurgency in the DRC (e.g., with airstrikes or the deployment of ground troops). The provision of support services alone would not count for a ""yes"" resolution (e.g., providing surveillance, transferring military equipment, sending military advisers). Inadvertent shelling or border crossing would also not count. For the purposes of this question, the acting countries or multinational organizations must acknowledge the intervention, though they do not need to use this term specifically. Whether the intervention is done with the assent of the government of the DRC is irrelevant. Outcome will be determined by credible open source media reports (e.g., Reuters, BBC, AP) or **official announcements.","false",5,date,"2014-11-12","2015-12-31","",active,"2014-11-12 13:00:00","2015-06-15 06:00:00",,
"1466","When will NATO next invoke Article 5 of the North Atlantic Treaty?","The North Atlantic Treaty is the founding document of the NATO alliance; Article 5 is the part of that treaty that establishes the principle of collective defense, under which an attack on any member is regarded as an attack on all members (http://www.nato.int/terrorism/five.htm, http://www.nato.int/cps/en/natolive/topics_67656.htm). Outcome will be determined by **official announcements or credible open source media reporting (e.g., Reuters, BBC, AP) of those announcements.","false",5,date,"2014-11-12","2015-12-31","",active,"2014-11-12 13:00:00","2015-06-15 06:00:00",,
"1467","When will negotiations on the Trans-Pacific Partnership (TPP) be completed?","TPP negotiations among twelve Pacific Rim nations have stalled; the parties met in early November 2014 as part of the Asia Pacific Economic Cooperation meetings in Beijing (http://www.reuters.com/article/2014/11/10/us-china-apec-usa-idUSKCN0IU0CW20141110, http://www.washingtonpost.com/world/japans-abe-says-tpp-trade-talks-with-us-are-near-the-final-stage/2014/11/07/24ba0b42-63a8-11e4-ab86-46000e1d0035_story.html). *Trade promotion authority, also called fast-track negotiation authority, must be passed by both houses of Congress for a ""yes"" resolution (http://online.wsj.com/articles/a-fresh-start-for-pacific-trade-1415577301, http://www.washingtonpost.com/posteverything/wp/2014/11/03/could-a-gop-senate-takeover-jumpstart-obamas-foreign-policy/). Outcome will be determined by credible open source media reporting (e.g., Reuters, BBC, AP) or **official announcements.","false",5,date,"2014-11-12","2015-12-31","",active,"2014-11-12 13:00:00","2015-06-15 06:00:00",,
"1468","When will France next deliver a Mistral-class ship to Russia?","France and Russia signed a deal for the delivery of two Mistral-class helicopter carriers, but delivery was delayed over the crisis in Ukraine; Russia is now threatening France if it does not deliver the carriers before 1 December 2014 (http://www.rferl.org/content/report-russia-gives-france-deadline-to-deliver-warship/26691527.html, http://www.reuters.com/article/2014/11/14/us-russia-france-mistral-idUSKCN0IY0XO20141114). Delivery of one of the carriers would suffice. Outcome will be determined by credible open source media reporting (e.g., Reuters, BBC, AP).","false",5,date,"2014-11-19","2015-12-31","",active,"2014-11-19 13:00:00","2015-06-15 06:00:00",,
