IFPID,Question,Description,Rolling Bins,# of Bins,Values Type,Range Low,Range High,Units,State,Start Date,Suspend Date,Closed As Of Date,Outcome
"1410","What percentage of those voting in the Scottish independence referendum will vote for independence?","Voting is scheduled for 18 September 2014. *For the referendum to pass, more than 50% of votes cast must be in favor of Scottish independence. Outcome will be determined when results of the vote are definitively reported in open source media (e.g., Reuters, BBC, AP). If the voting is delayed indefinitely or cancelled, or in other cases of substantial controversy or uncertainty, Administrator reserves the right to consult outside experts about how to proceed and/or void the question.","false",4,number,"20","50","% of votes",closed,"2014-08-20 06:00:00","2014-09-17 06:00:00","2014-08-20 06:00:00","44.7"
"1411","When will North Korea next test a long-range missile?","*A long-range missile will be considered, in this case, one that has the reported ability to reach the continental United States, Alaska, or Hawaii. The test of rocket engines with the capacity to hit the continental United States, Alaska, or Hawaii would also count for a ""yes"" resolution. A past example of a test that would count is North Korea's space launch on December 12, 2012 (http://www.nytimes.com/2012/12/24/world/asia/north-korean-rocket-had-military-purpose-seoul-says.html?_r=0). The success of the test, and the actual distance traveled, are irrelevant. South Korea is weighing options for its missile defense needs (http://koreajoongangdaily.joins.com/news/article/Article.aspx?aid=2992350; http://www.bloomberg.com/news/2014-06-04/south-korea-eyes-thaad-patriot-3-missile-systems-u-s-says.html). For the purposes of this question, the following situations will count as the condition being realized: a) South Korea agrees to allow U.S. Forces in Korea to deploy and control the THAAD system, b) South Korea agrees to receive a loan of the THAAD system, or c) South Korea agrees to purchase the THAAD system. Actual deployment of the THAAD system is not required. Outcome will be determined by credible open source media reporting (e.g., Reuters, BBC, AP).","false",4,date,"2014-08-20","2015-12-31","",active,"2014-08-20 06:00:00","2015-07-01 06:00:00",,
"1411","When will North Korea next test a long-range missile?","*A long-range missile will be considered, in this case, one that has the reported ability to reach the continental United States, Alaska, or Hawaii. The test of rocket engines with the capacity to hit the continental United States, Alaska, or Hawaii would also count for a ""yes"" resolution. A past example of a test that would count is North Korea's space launch on December 12, 2012 (http://www.nytimes.com/2012/12/24/world/asia/north-korean-rocket-had-military-purpose-seoul-says.html?_r=0). The success of the test, and the actual distance traveled, are irrelevant. South Korea is weighing options for its missile defense needs (http://koreajoongangdaily.joins.com/news/article/Article.aspx?aid=2992350; http://www.bloomberg.com/news/2014-06-04/south-korea-eyes-thaad-patriot-3-missile-systems-u-s-says.html). For the purposes of this question, the following situations will count as the condition being realized: a) South Korea agrees to allow U.S. Forces in Korea to deploy and control the THAAD system, b) South Korea agrees to receive a loan of the THAAD system, or c) South Korea agrees to purchase the THAAD system. Actual deployment of the THAAD system is not required. Outcome will be determined by credible open source media reporting (e.g., Reuters, BBC, AP).","false",4,date,"2014-08-20","2015-12-31","",active,"2014-08-20 06:00:00","2015-07-01 06:00:00",,
"1412","Where will the TOPIX Index close on 31 October 2014?","TOPIX is the Tokyo Stock Price Index, a weighted index of all companies listed on the first section of the Tokyo Stock Exchange. Outcome will be determined by the end-of-day closing values reported by Bloomberg during the question's open period, at http://www.bloomberg.com/quote/TPX:IND/chart. In case of delayed reporting or problems with the Bloomberg website, reporting by other credible open sources may be used (e.g., Reuters, BBC, AP).","false",4,number,"1200","1400","points",closed,"2014-08-20 06:00:00","2014-10-31 07:00:00","2014-08-20 06:00:00","1333.64"
"1413","When will the Kurdistan Regional Government *hold a referendum on national independence?","Amidst a backdrop of violence in Iraq, Kurdish leader Masud Barzani has discussed plans for holding an independence referendum in the region (http://www.vox.com/2014/8/12/5991425/kurds-iraq-kurdistan-peshmerga, http://www.rferl.org/content/iraq-kurds-independence-talk-power-play/25459559.html). *The question will resolve as ""yes"" when credible open source media report that voting in a referendum has begun. A referendum held in the city of Kirkuk, outside the Kurdish region, would not count for the purposes of this question. Outcome will be determined by credible open source media reporting (e.g., Reuters, BBC, AP).","false",4,date,"2014-08-20","2015-12-31","",active,"2014-08-20 06:00:00","2015-12-31 06:00:00",,
"1414","How many square kilometers will be covered in Arctic sea ice on 15 September 2014?","*The sea ice extent is the total surface area of the Arctic under ice cover; a lower sea ice extent makes shipping and fishing in the region more feasible. In recent years, mid-September has marked the point at which Arctic sea ice extent has decreased to its lowest point, after which the freeze begins again. On 15 September 2013, the Arctic sea ice extent was 4,834,931 square kilometers (km2). Outcome will be determined on 15 September 2014 by the Japan Aerospace Exploration Agency's Arctic Sea Ice Monitor, at http://www.ijis.iarc.uaf.edu/en/home/seaice_extent.htm. For historical trends, click ""data download"" and save as a csv file.","false",4,number,"4593000","5560000","square kilometers",closed,"2014-08-20 06:00:00","2015-06-30 06:00:00","2014-08-20 06:00:00","4888765.0"
"1415","When will there be a **lethal confrontation involving Russian **national military forces in Ukraine?","**Lethal confrontation, in this case, refers to a direct clash involving Russian **national military forces that results in at least three (3) fatalities from among the actors involved (e.g., Russian forces, Ukrainian national military forces, insurgent fighters). Civilian fatalities will not count for the purposes of this question. Outcome will be determined by credible open source media reporting (e.g., Reuters, BBC, AP).","false",4,date,"2014-08-20","2015-12-31","",closed,"2014-08-20 06:00:00","2014-08-29 06:00:00","2014-08-20 06:00:00","2014-08-25 06:00:00"
"1416","When will North Korea next detonate a nuclear device?","Past examples of North Korean nuclear detonations include those listed here: http://www.bbc.com/news/world-asia-17823706. There has been speculation that North Korea may be planning a nuclear detonation (http://38north.org/2014/08/punggye081114/). A detonation either for testing or military purposes would count; however, computer simulations, controlled chain reactions within nuclear reactors, or detonation of radiological devices (e.g., ""dirty bombs"") will not count. Outcome will be determined by credible open source media reporting (e.g., Reuters, BBC, AP).","false",5,date,"2014-08-27","2014-12-31","",closed,"2014-08-27 13:00:00","2015-07-01 06:00:00","2014-08-27 13:00:00","2100-12-31 06:00:00"
"1417","When will Kim Jong Un next meet a *head of state from one of the G7 countries, South Korea, China, or Russia?","*Heads of state from the G7 countries, South Korea, China, or Russia refer to the following people or their successors: Prime Minister Stephen Harper (Canada), President Francois Hollande (France), Chancellor Angela Merkel (Germany), Prime Minister Mateo Renzi (Italy), Prime Minister Shinzo Abe (Japan), Prime Minister David Cameron (United Kingdom), President Barack Obama (United States), President Park Gyun-Hye (South Korea), President Xi Jinping (China), or President Vladimir Putin (Russia). Outcome will be determined by credible open source media reporting (e.g., Reuters, BBC, AP).","false",5,date,"2014-08-27","2015-12-31","1",active,"2014-08-27 13:00:00","2015-06-01 06:00:00",,
"1418","When will Afghanistan next sign a Bilateral Security Agreement with the United States?","A draft Bilateral Security Agreement between Afghanistan and the United States was reached in November 2013, and both Afghan presidential candidates have indicated a willingness to sign it (http://www.defensenews.com/article/20140708/DEFREG01/307080027/NATO-Chief-Warns-Afghanistan-Must-Sign-Security-Pact-by-Early-September, http://www.voanews.com/content/us-ambassador-deadlines-loom-in-afghanistan/2417392.html). For the purposes of this question, ratification is not required. Outcome will be determined by credible open source media reporting (e.g., Reuters, BBC, AP) or **official announcements.","false",5,date,"2014-08-27","2015-06-11","",closed,"2014-08-27 13:00:00","2015-06-11 06:00:00","2014-08-27 13:00:00","2014-09-29 06:00:00"
"1419","When will the World Trade Organization's Trade Facilitation Agreement (TFA) protocol be approved by all WTO members?","On 31 July 2014, India refused to approve the WTO's Trade Facilitation Agreement (TFA), citing concerns about the WTO's food subsidy rules; a ""yes"" resolution requires that all member states reach a consensus to approve the TFA protocol (http://www.reuters.com/article/2014/07/31/us-india-trade-wto-idUSKBN0G009R20140731). The TFA does not need to be domestically ratified by member states nor does it need to enter into force for the purposes of this question. *New WTO food subsidy rules would include either the maximum amount of allowed food subsidy being increased (from 10%), or the base year used to calculate food prices being changed (from 1986-88) (http://www.nytimes.com/2014/08/04/opinion/global-trade-talks-suffer-another-setback.html?_r=0). Outcome will be determined by credible open source media reporting (e.g., Reuters, BBC, AP).","false",4,date,"2014-08-27","2015-12-31","",closed,"2014-08-27 13:00:00","2015-06-11 06:00:00","2014-08-27 13:00:00","2014-11-27 06:00:00"
"1420","When will China officially declare an *Air-Defense Identification Zone (ADIZ) over the South China Sea?","*An Air-Defense Identification Zone (ADIZ) is an area extending beyond a country's territory in which unidentified aircraft are eligible for interception. For more information, see http://www.ft.com/intl/cms/s/0/26cf55ce-58da-11e3-a7cb-00144feabdc0.html#axzz39dxcogMz. The official declaration of a new ADIZ over any part of the South China Sea would count, as would an extension of the existing Chinese ADIZ in the East China Sea. For more information on the conflict in the South China Sea, see http://www.cfr.org/china/south-china-sea-tensions/p29790. Outcome will be determined by credible open source media reporting (e.g., Reuters, BBC, AP) or **official announcements.","false",5,date,"2014-08-27","2015-12-31","",active,"2014-08-27 06:00:00","2015-06-11 06:00:00",,
"1421","When will the New Development Bank **officially announce that a loan will be made to a country?","Brazil, Russia, India, China, and South Africa (when grouped together, the BRICS) created the New Development Bank in July 2014, with the intent to extend development loans as a counterweight to the IMF and World Bank (http://www.washingtonpost.com/blogs/monkey-cage/wp/2014/07/17/what-the-new-bank-of-brics-is-all-about/). The actual disbursement of a loan is not required for a ""yes"" resolution. Outcome will be determined by credible open source media reporting (e.g., Reuters, BBC, AP) or **official announcements.","false",5,date,"2014-08-27","2015-12-31","",active,"2014-08-26 06:00:00","2015-06-11 06:00:00",,
"1422","When will Islamic State (IS) fighters **attack a country other than Iraq or Syria?","The insurgent group Islamic State (IS), also known as ISIL or ISIS, has posed a threat to the Middle East in recent months (http://www.cfr.org/iraq/islamic-state-iraq-syria/p14811). Changes in Islamic State's name or composition are irrelevant, so long as the group does not disband entirely; an official successor group will count. Outcome will be determined by credible open source media reporting (e.g., Reuters, BBC, AP).","false",5,date,"2014-08-27","2015-12-31","",voided,"2014-08-27 06:00:00","2015-06-11 06:00:00",,
"1423","When will China **officially announce a *peak year for its carbon emissions?","China faces international pressure to announce a peak year (or ""cap"" year) for its carbon emissions. *A peak year is the one in which the maximum emission level is reached and would subsequently be reduced in years to follow (http://dotearth.blogs.nytimes.com/2014/07/15/china-clarifies-its-plans-on-setting-a-co2-emissions-peak/). Outcome will be determined by credible open source media (e.g., Reuters, BBC, AP) or **official announcements.","false",5,date,"2015-01-01","2015-12-31","",closed,"2014-09-03 13:00:00","2015-05-31 06:00:00","2014-09-03 13:00:00","2014-11-11 06:00:00"
"1424","What will the highest end-of-day close for the U.S. dollar-Russian ruble exchange rate be **between 3 September 2014 and 30 November 2014?","Outcome will be determined by the highest end-of-day closing value reported by Bloomberg, at http://www.bloomberg.com/quote/USDRUB:CUR. For historical trends, see http://www.bloomberg.com/quote/USDRUB:CUR/chart. In case of delayed reporting or problems with the Bloomberg website, reporting by other credible open sources may be used.","false",5,number,"30","45","",closed,"2014-09-03 13:00:00","2014-11-29 06:00:00","2014-09-03 13:00:00","49.467"
"1425","When will ambassadors from Bahrain, Saudi Arabia, or the United Arab Emirates officially return to their posts in Qatar?","In March 2014, Bahrain, Saudi Arabia, and the United Arab Emirates withdrew their ambassadors from Qatar over tensions among the countries on how to handle regional issues (http://www.bbc.com/news/world-middle-east-26447914). A ""yes"" resolution requires the official, physical return of at least one of the ambassadors to their post in Qatar; an announcement of the intent to send an ambassador back to Qatar will not suffice. Furthermore, the question refers only to those with the rank/title of ambassador; any other official personnel, including charges d'affaires, will not suffice. Whether the same ambassador returns or a new ambassador is appointed to the post in Qatar is irrelevant for the resolution of the question. Outcome will be determined by credible open source media reporting (e.g., Reuters, BBC, AP).","false",5,date,"2014-09-03","2015-06-11","",closed,"2014-09-03 13:00:00","2015-05-31 06:00:00","2014-09-03 13:00:00","2014-11-17 06:00:00"
"1426","How many European banks will *fail the European Central Bank's *comprehensive assessment?","The European Central Bank (ECB) will become the new central supervisor for the entire euro-area banking system in November 2014; in preparation, European banks must undergo a *comprehensive assessment by the ECB, which includes asset quality reviews and stress tests to be completed in October 2014 (http://online.wsj.com/articles/ecb-will-incorporate-asset-review-findings-into-stress-tests-1407490720, http://www.bloomberg.com/news/2014-08-08/ecb-says-banks-bending-stress-test-rules-to-be-shown-red-light.html). A *failure of this comprehensive assessment will be indicated by banks receiving an initial ""red light"" result. Any subsequent revisions to initial ratings, including revisions to red light ratings, will be irrelevant for the resolution of the question. Outcome will be determined by credible open source media reporting (e.g., Reuters, BBC, AP) or **official announcements by the ECB (http://www.ecb.europa.eu/ssm/assessment/html/index.en.html).","false",5,number,"0","60","banks",voided,"2014-09-03 13:00:00","2014-12-01 06:00:00",,
"1427","When will Russia officially annex any *additional Ukrainian territory?","In March 2014, Russia signed a treaty with the government of the Republic of Crimea officially incorporating the latter into the former (http://www.reuters.com/article/2014/03/18/us-ukraine-crisis-idUSBREA1Q1E820140318). Russia will be considered to have officially annexed Ukrainian territory if it incorporates *additional territory (i.e., aside from Crimea) that currently belongs to Ukraine, including contested territory claimed by separatist rebels. A ""yes"" resolution does not require that any other country recognize the annexation, only that Russia **officially announces the incorporation, accession, or other similar process, of Ukrainian territory into the Russian Federation (http://www.washingtonpost.com/world/russias-putin-prepares-to-annex-crimea/2014/03/18/933183b2-654e-45ce-920e-4d18c0ffec73_story.html). Outcome will be determined by credible open source media reporting (e.g., Reuters, BBC, AP) or **official announcements.","false",5,date,"2014-09-03","2015-12-15","",active,"2014-09-03 13:00:00","2015-12-31 06:00:00",,
"1428","When will Nawaz Sharif **vacate the office of Prime Minister of Pakistan?","Pakistani Prime Minister Nawaz Sharif is facing pressure to resign, but vows to remain in office (http://www.bloomberg.com/news/2014-08-27/sharif-says-pakistan-s-law-and-constitution-will-be-upheld.html). **A leader will be deemed to have vacated their office if they have 1) died; 2) resigned their office; 3) been stripped of their office and/or replaced (by, e.g., judicial rulings, electorate action, or military coups); 4) fled the country, gone into exile, or disappeared entirely from public view such that it is unclear whether they are alive or residing within the nation they govern; or 5) been deemed in a prolonged state of mental incapacitation. In the first three situations, the question will close immediately; for options 4 and 5, Administrator will typically observe a three-week waiting period, after which the question will be closed retroactively to when the circumstance was first reported in the media. Outcome will be determined by credible open source media reporting (e.g., Reuters, BBC, AP) or **official announcements.","false",5,date,"2014-09-03","2015-06-11","",active,"2014-09-03 13:00:00","2015-12-31 06:00:00",,
"1429","When will **national military force(s) from one or more countries *intervene in Syria?","Syria, destabilized by civil war, is one of the countries out of which the Islamic State (IS) is operating (http://www.nytimes.com/2014/08/23/world/middleeast/assad-supporters-weigh-benefits-of-us-strikes-in-syria.html). An *intervention, in this case, will be considered the use of **national military force(s) to oppose armed groups in Syria (e.g., airstrikes, the deployment of troops). The provision of support services alone will not be sufficient (e.g., sending military advisers, providing surveillance, or transferring military equipment). For the purposes of this question, the countries represented must acknowledge the intervention, though they do not have to use this term specifically. Whether the intervention is done with the assent of the Syrian government is irrelevant. Inadvertent shelling or border crossing would not count. Outcome will be determined by credible open source media reporting (e.g., Reuters, BBC, AP).","false",5,date,"2014-09-03","2015-06-11","",closed,"2014-09-03 13:00:00","2014-11-30 06:00:00","2014-09-03 13:00:00","2014-09-22 06:00:00"
"1430","When will there next be a **lethal confrontation between China's **national military forces and the **national military forces of another country in the South China Sea region?","For more information on conflict in the South China Sea, see http://www.cfr.org/china/south-china-sea-tensions/p29790. For the purposes of this question, **national military forces includes law enforcement and coast guards. Outcome will be determined by credible open source media reporting (e.g., Reuters, BBC, AP).","false",5,date,"2014-09-17","2015-12-31","",active,"2014-09-17 13:00:00","2015-06-15 06:00:00",,
"1431","**As of 24 November 2014, how many centrifuges for uranium activity will Iran have agreed to operate?","Iran and the P5+1 remain at odds over the number of centrifuges required for Iran to maintain a civil nuclear enrichment program (http://www.reuters.com/article/2014/09/11/us-iran-nuclear-idUSKBN0H60YP20140911, http://www.economist.com/news/middle-east-and-africa/21608803-west-and-iran-will-negotiate-four-more-months-gap-wide-time). Outcome will be determined by **official announcements or credible open source media reporting (e.g., Reuters, BBC, AP). There must be evidence that both Iran and the P5+1 have agreed on the number of operational centrifuges.","false",5,number,"2000","40000","centrifuges",voided,"2014-09-17 13:00:00","2015-06-15 06:00:00",,
"1432","When will the VSTOXX Index next close at or above 23.00?","The VSTOXX is an index representing the volatility of the EURO STOXX 50 index. Outcome will be determined according to the STOXX website, at http://www.stoxx.com/indices/index_information.html?symbol=V2TX. Historical data can be found under the ""Chart"" tab. In case of problems with the STOXX website, data reported by other credible open sources may be used. ","false",4,date,"2014-09-17","2015-06-11","",closed,"2014-09-17 13:00:00","2015-06-11 06:00:00","2014-09-17 13:00:00","2014-10-09 06:00:00"
"1433","When will the Oil Volatility Index (OVX) next close above 25.00?","A high value for the Oil Volatility Index (OVX) is representative of larger price deviations from the mean daily price of West Texas Intermediate (WTI) crude oil. Outcome will be determined by the closing price quote from the Chicago Board Options Exchange (CBOE) at http://www.cboe.com/micro/oilvix/introduction.aspx. In case of problems with the CBOE website, data reported by other credible open sources may be used.","false",4,date,"2014-09-17","2015-06-11","",closed,"2014-09-17 13:00:00","2015-06-04 06:00:00","2014-09-17 13:00:00","2014-10-07 06:00:00"
"1434","When will Bulgaria **officially announce that work on the South Stream Pipeline project will resume?","Bulgaria is a critical point for Russia's South Stream Pipeline project to bring gas into southeastern Europe and Austria (http://www.nytimes.com/2014/07/01/business/international/south-stream-pipeline-project-in-bulgaria-is-delayed.html?_r=0). In June 2014, pressured by the EU and the US to put an end to South Stream, Bulgaria announced that work on the project would be suspended despite Russian pressure to continue (http://www.ft.com/intl/cms/s/0/828f0226-efe1-11e3-bee7-00144feabdc0.html?siteedition=intl#axzz3CMUiTZhx, http://www.bbc.com/news/business-28854089). **Official announcements about the resumption of any work related to the project (e.g., contract negotiations, construction) would count. Outcome will be determined by credible open source media reporting (e.g., Reuters, BBC, AP). If the resolution criteria are not met, GJP will assume the following as the ""status quo"" outcome: Bulgaria has not **officially announced that work on the South Stream Pipeline project will resume.","false",4,date,"2014-09-17","2015-06-11","",active,"2014-09-17 13:00:00","2015-06-11 06:00:00",,
"1435","When will NATO invite any new country to join the *Membership Action Plan (MAP)?","NATO *Membership Action Plans (MAPs) are ""programs of advice, assistance and practical support tailored to the individual needs of countries wishing to join the Alliance"" (http://www.nato.int/cps/en/natohq/topics_49212.htm, http://www.bbc.com/news/world-europe-28978699). Invitations to the MAP will count even if they come with conditions, e.g.,  requiring specific reforms to be instituted first. Changes to the status of existing MAP invitations will not count for the purposes of this question (i.e., Bosnia and Herzegovina, Macedonia, and Montenegro). Outcome will be determined by credible open source media reporting (e.g., Reuters, BBC, AP). If the resolution criteria are not met, GJP will assume the following as the ""status quo"" outcome: NATO has not invited any new countries to join the Membership Action Plan (MAP).","false",4,date,"2014-09-17","2015-12-31","",active,"2014-09-17 13:00:00","2015-06-11 06:00:00",,
"1436","How many Eurozone banks will fail the European Central Bank's *comprehensive assessment?","The European Central Bank (ECB) will become the new central supervisor for the entire euro-area banking system in November 2014; before then, Eurozone-area banks must undergo a *comprehensive assessment by the ECB (http://www.ecb.europa.eu/ssm/assessment/html/index.en.html). According to the ECB, failing banks will have either fallen short of an 8% minimum capital ""hurdle rate"" in an asset quality review and baseline-scenario stress test or will have fallen short of a minimum capital hurdle rate of 5.5% in an adverse-scenario stress test (e.g., http://www.ecb.europa.eu/press/pr/date/2014/html/pr140429_1.en.html, http://www.ecb.europa.eu/ssm/assessment/html/index.en.html, and http://www.ecb.europa.eu/pub/pdf/other/comprehensiveassessmentdisclosuretemplate201407enen.pdf [boxes at the bottom of page 1]). Outcome will be determined by the ECB or credible open source media reporting (e.g., Reuters, BBC, AP).","false",4,number,"2","40","banks",closed,"2014-09-17 13:00:00","2014-10-26 07:00:00","2014-09-17 13:00:00","25.0"
